{
  "policyKind": "approval_roles",
  "version": 1,
  "effectiveFrom": "1970-01-01T00:00:00Z",
  "effectiveTo": null,
  "scope": { "tenantId": "00000000-0000-0000-0000-000000000000", "siteId": null, "unitId": null },
  "notes": "Seed default recorded 2026-10-07 from D06 ('based on proposed and standard'): spec 13.2 roles; production engineers submit, manager approvers approve/reject/revise; one approver; self-approval always forbidden. Legacy map: SuperAdmin/OrgAdmin -> all roles (still never self-approval), TenantAdmin/Manager -> manager_approver, Engineer/Analyst -> production_engineer, Operator -> operator. scope.tenantId is a placeholder that the seeder replaces.",
  "body": {
    "submitRoles": ["production_engineer"],
    "approveRoles": ["manager_approver"],
    "reviseRoles": ["manager_approver"],
    "requireTwoApprovers": false,
    "forbidSelfApproval": true,
    "legacyRoleMap": {
      "SuperAdmin": [
        "operator",
        "production_engineer",
        "manager_approver",
        "reliability_engineer",
        "integration_admin",
        "master_data_admin",
        "viewer"
      ],
      "OrgAdmin": [
        "operator",
        "production_engineer",
        "manager_approver",
        "reliability_engineer",
        "integration_admin",
        "master_data_admin",
        "viewer"
      ],
      "TenantAdmin": ["manager_approver"],
      "Manager": ["manager_approver"],
      "Analyst": ["production_engineer"],
      "Engineer": ["production_engineer"],
      "Operator": ["operator"]
    }
  }
}
